<?xml version="1.0" encoding="UTF-8"?>

<juego xmlns:xsi="http://www.w3.org/2001/XMLSchema-instance" xsi:noNamespaceSchemaLocation="datos.xsd">

    <semillas>

        <semilla id="tomate">
            <nombre>Tomate</nombre>
            <tiempoMaduracion>3</tiempoMaduracion>
            <precioCompra>5</precioCompra>
            <precioVenta>20</precioVenta>
            <tipo>hortaliza</tipo>
            <imagenes>
                <semilla>semilla.png</semilla>
                <creciendo>tomate_creciendo.png</creciendo>
                <maduro>tomate_maduro.png</maduro>
            </imagenes>
        </semilla>

        <semilla id="zanahoria">
            <nombre>Zanahoria</nombre>
            <tiempoMaduracion>2</tiempoMaduracion>
            <precioCompra>4</precioCompra>
            <precioVenta>15</precioVenta>
            <tipo>hortaliza</tipo>
            <imagenes>
                <semilla>semilla.png</semilla>
                <creciendo>zanahoria_creciendo.png</creciendo>
                <maduro>zanahoria_maduro.png</maduro>
            </imagenes>
        </semilla>

        <semilla id="maiz">
            <nombre>Maiz</nombre>
            <tiempoMaduracion>4</tiempoMaduracion>
            <precioCompra>6</precioCompra>
            <precioVenta>30</precioVenta>
            <tipo>cereal</tipo>
            <imagenes>
                <semilla>semilla.png</semilla>
                <creciendo>maiz_creciendo.png</creciendo>
                <maduro>maiz_maduro.png</maduro>
            </imagenes>
        </semilla>

        <semilla id="caracol">
            <nombre>Caracol</nombre>
            <tiempoMaduracion>5</tiempoMaduracion>
            <precioCompra>8</precioCompra>
            <precioVenta>40</precioVenta>
            <tipo>especial</tipo>
            <imagenes>
                <semilla>semilla.png</semilla>
                <creciendo>caracol.png</creciendo>
                <maduro>caracol_maduro.png</maduro>
            </imagenes>
        </semilla>

        <semilla id="fresa">
            <nombre>Fresa</nombre>
            <tiempoMaduracion>2</tiempoMaduracion>
            <precioCompra>5</precioCompra>
            <precioVenta>18</precioVenta>
            <tipo>fruta</tipo>
            <imagenes>
                <semilla>semilla.png</semilla>
                <creciendo>fresa_creciendo.png</creciendo>
                <maduro>fresa_maduro.png</maduro>
            </imagenes>
        </semilla>

        <semilla id="girasol">
            <nombre>Girasol</nombre>
            <tiempoMaduracion>6</tiempoMaduracion>
            <precioCompra>10</precioCompra>
            <precioVenta>50</precioVenta>
            <tipo>especial</tipo>
            <imagenes>
                <semilla>semilla.png</semilla>
                <creciendo>girasol_creciendo.png</creciendo>
                <maduro>girasol_maduro.png</maduro>
            </imagenes>
        </semilla>

        <semilla id="rosa">
            <nombre>Rosa</nombre>
            <tiempoMaduracion>6</tiempoMaduracion>
            <precioCompra>10</precioCompra>
            <precioVenta>50</precioVenta>
            <tipo>especial</tipo>
            <imagenes>
                <semilla>semilla.png</semilla>
                <creciendo>rosa_creciendo.png</creciendo>
                <maduro>rosa_maduro.png</maduro>
            </imagenes>
        </semilla>

        <!-- NUEVA PLANTA: fresa — fruta grande, tiempo largo, precio alto -->
        <semilla id="fresa">
            <nombre>Fresa</nombre>
            <tiempoMaduracion>8</tiempoMaduracion>
            <precioCompra>12</precioCompra>
            <precioVenta>75</precioVenta>
            <tipo>fruta</tipo>
            <imagenes>
                <semilla>semilla.png</semilla>
                <creciendo>fresa_creciendo.png</creciendo>
                <maduro>fresa_maduro.png</maduro>
            </imagenes>
        </semilla>

        <semilla id="fresa2">
            <nombre>fresa2</nombre>
            <tiempoMaduracion>3</tiempoMaduracion>
            <precioCompra>17</precioCompra>
            <precioVenta>20</precioVenta>
            <tipo>fruta</tipo>
            <imagenes>
                <semilla>semilla.png</semilla>
                <creciendo>fresa_creciendo.png</creciendo>
                <maduro>fresa_maduro.png</maduro>
            </imagenes>
        </semilla>

    </semillas>

    <herramientas>

        <herramienta id="azada">
            <nombre>Azada</nombre>
            <imagen>azada.png</imagen>
            <descripcion>Mejora la calidad del cultivo y el precio de venta.</descripcion>
            <niveles>
                <nivel numero="1">
                    <nombre>Básico</nombre>
                    <bonusPrecioVenta>1.0</bonusPrecioVenta>
                    <costeMejora>0</costeMejora>
                </nivel>
                <nivel numero="2">
                    <nombre>Mejorado</nombre>
                    <bonusPrecioVenta>1.25</bonusPrecioVenta>
                    <costeMejora>80</costeMejora>
                </nivel>
                <nivel numero="3">
                    <nombre>Maestro</nombre>
                    <bonusPrecioVenta>1.5</bonusPrecioVenta>
                    <costeMejora>200</costeMejora>
                </nivel>
            </niveles>
        </herramienta>

        <herramienta id="regadera">
            <nombre>Regadera</nombre>
            <imagen>regadera.png</imagen>
            <descripcion>Reduce el tiempo de maduración de los cultivos.</descripcion>
            <niveles>
                <nivel numero="1">
                    <nombre>Básico</nombre>
                    <bonusReduccionTiempo>0</bonusReduccionTiempo>
                    <costeMejora>0</costeMejora>
                </nivel>
                <nivel numero="2">
                    <nombre>Mejorado</nombre>
                    <bonusReduccionTiempo>1</bonusReduccionTiempo>
                    <costeMejora>100</costeMejora>
                </nivel>
                <nivel numero="3">
                    <nombre>Maestro</nombre>
                    <bonusReduccionTiempo>2</bonusReduccionTiempo>
                    <costeMejora>250</costeMejora>
                </nivel>
            </niveles>
        </herramienta>

        <herramienta id="hoz">
            <nombre>Hoz</nombre>
            <imagen>hoz.png</imagen>
            <descripcion>Mejora la eficiencia de recolección.</descripcion>
            <niveles>
                <nivel numero="1">
                    <nombre>Básico</nombre>
                    <bonusFrutosExtra>0</bonusFrutosExtra>
                    <costeMejora>0</costeMejora>
                </nivel>
                <nivel numero="2">
                    <nombre>Mejorado</nombre>
                    <bonusFrutosExtra>1</bonusFrutosExtra>
                    <costeMejora>120</costeMejora>
                </nivel>
                <nivel numero="3">
                    <nombre>Maestro</nombre>
                    <bonusFrutosExtra>2</bonusFrutosExtra>
                    <costeMejora>300</costeMejora>
                </nivel>
            </niveles>
        </herramienta>

    </herramientas>

</juego>